<?xml version="1.0" encoding="UTF-8"?>
<!DOCTYPE library SYSTEM "./Task1.dtd">
<library>
    <info>
        <location>&Address;</location>
        <description> The greatest library of all time. </description>
        <librarian name="Ahmed Ali"></librarian>
    </info>
    <Books>
        <book ISBN="EG_101">
            <title><![CDATA[ && means logical "AND" Operation ]]></title>
            <author name="AUTHOR" gender="M"/>
            <preface>preface</preface>
            <part PartTitle="i_1st_B1">
                <chapter ChapterTitle="1">
                    <summary></summary>
                    <Sections>
                        <p>content</p>
                        <p>content</p>
                        <p>content</p>
                        <p>content</p>
                    </Sections>
                </chapter>
                <chapter ChapterTitle="2">
                    <summary></summary>
                        <Sections>
                        <p>content</p>
                        <p>content</p>
                        <p>content</p>
                        <p>content</p>
                    </Sections>> </chapter>
                <chapter ChapterTitle="3">
                    <summary></summary>
                        <Sections>
                        <p>content</p>
                        <p>content</p>
                        <p>content</p>
                        <p>content</p>
                    </Sections>> </chapter>
            </part>
            <part PartTitle="ii_2nd_B1">
                <chapter ChapterTitle="4">
                    <summary></summary>
                    <Sections>
                        <p>content</p>
                        <p>content</p>
                        <p>content</p>
                        <p>content</p>
                    </Sections>
                </chapter>
                <chapter ChapterTitle="5">
                    <summary></summary>
                        <Sections>
                        <p>content</p>
                        <p>content</p>
                        <p>content</p>
                        <p>content</p>
                    </Sections>> </chapter>
                <chapter ChapterTitle="6">
                    <summary></summary>
                        <Sections>
                        <p>content</p>
                        <p>content</p>
                        <p>content</p>
                        <p>content</p>
                    </Sections>> </chapter>
            </part>
            <part PartTitle="iii_3rd_B1">
                <chapter ChapterTitle="7">
                    <summary></summary>
                    <Sections>
                        <p>content</p>
                        <p>content</p>
                        <p>content</p>
                        <p>content</p>
                    </Sections>
                </chapter>
                <chapter ChapterTitle="8">
                    <summary></summary>
                        <Sections>
                        <p>content</p>
                        <p>content</p>
                        <p>content</p>
                        <p>content</p>
                    </Sections>> </chapter>
                <chapter ChapterTitle="9">
                    <summary></summary>
                        <Sections>
                        <p>content</p>
                        <p>content</p>
                        <p>content</p>
                        <p>content</p>
                    </Sections>> </chapter>
            </part>
        </book>
        <book ISBN="EG_102">
            <title><![CDATA[ This "" means double qutotation ]]></title>
            <author name="AUTHOR" gender="F"/>
            <preface>preface</preface>
            <part PartTitle="i_1st_B2">
                <chapter ChapterTitle="1">
                    <summary></summary>
                    <Sections>
                        <p>content</p>
                        <p>content</p>
                        <p>content</p>
                        <p>content</p>
                    </Sections>
                </chapter>
                <chapter ChapterTitle="2">
                    <summary></summary>
                        <Sections>
                        <p>content</p>
                        <p>content</p>
                        <p>content</p>
                        <p>content</p>
                    </Sections>> </chapter>
                <chapter ChapterTitle="3">
                    <summary></summary>
                        <Sections>
                        <p>content</p>
                        <p>content</p>
                        <p>content</p>
                        <p>content</p>
                    </Sections>> </chapter>
            </part>
            <part PartTitle="ii_2nd_B2">
                <chapter ChapterTitle="4">
                    <summary></summary>
                    <Sections>
                        <p>content</p>
                        <p>content</p>
                        <p>content</p>
                        <p>content</p>
                    </Sections>
                </chapter>
                <chapter ChapterTitle="5">
                    <summary></summary>
                        <Sections>
                        <p>content</p>
                        <p>content</p>
                        <p>content</p>
                        <p>content</p>
                    </Sections>> </chapter>
                <chapter ChapterTitle="6">
                    <summary></summary>
                        <Sections>
                        <p>content</p>
                        <p>content</p>
                        <p>content</p>
                        <p>content</p>
                    </Sections>> </chapter>
            </part>
            <part PartTitle="iii_3rd_B2">
                <chapter ChapterTitle="7">
                    <summary></summary>
                    <Sections>
                        <p>content</p>
                        <p>content</p>
                        <p>content</p>
                        <p>content</p>
                    </Sections>
                </chapter>
                <chapter ChapterTitle="8">
                    <summary></summary>
                        <Sections>
                        <p>content</p>
                        <p>content</p>
                        <p>content</p>
                        <p>content</p>
                    </Sections>> </chapter>
                <chapter ChapterTitle="9">
                    <summary></summary>
                        <Sections>
                        <p>content</p>
                        <p>content</p>
                        <p>content</p>
                        <p>content</p>
                    </Sections>> </chapter>
            </part>
        </book>
        <book ISBN="EG_103">
            <title><![CDATA[ This '' means single qutotation ]]></title>
            <author name="AUTHOR" gender="F"/>
            <preface>preface</preface>
            <part PartTitle="i_1st_B3">
                <chapter ChapterTitle="1">
                    <summary></summary>
                    <Sections>
                        <p>content</p>
                        <p>content</p>
                        <p>content</p>
                        <p>content</p>
                    </Sections>
                </chapter>
                <chapter ChapterTitle="2">
                    <summary></summary>
                        <Sections>
                        <p>content</p>
                        <p>content</p>
                        <p>content</p>
                        <p>content</p>
                    </Sections>> </chapter>
                <chapter ChapterTitle="3">
                    <summary></summary>
                        <Sections>
                        <p>content</p>
                        <p>content</p>
                        <p>content</p>
                        <p>content</p>
                    </Sections>> </chapter>
            </part>
            <part PartTitle="ii_2nd_B3">
                <chapter ChapterTitle="4">
                    <summary></summary>
                    <Sections>
                        <p>content</p>
                        <p>content</p>
                        <p>content</p>
                        <p>content</p>
                    </Sections>
                </chapter>
                <chapter ChapterTitle="5">
                    <summary></summary>
                        <Sections>
                        <p>content</p>
                        <p>content</p>
                        <p>content</p>
                        <p>content</p>
                    </Sections>> </chapter>
                <chapter ChapterTitle="6">
                    <summary></summary>
                        <Sections>
                        <p>content</p>
                        <p>content</p>
                        <p>content</p>
                        <p>content</p>
                    </Sections>> </chapter>
            </part>
            <part PartTitle="iii_3rd_B3">
                <chapter ChapterTitle="7">
                    <summary></summary>
                    <Sections>
                        <p>content</p>
                        <p>content</p>
                        <p>content</p>
                        <p>content</p>
                    </Sections>
                </chapter>
                <chapter ChapterTitle="8">
                    <summary></summary>
                        <Sections>
                        <p>content</p>
                        <p>content</p>
                        <p>content</p>
                        <p>content</p>
                    </Sections>> </chapter>
                <chapter ChapterTitle="9">
                    <summary></summary>
                        <Sections>
                        <p>content</p>
                        <p>content</p>